{
  "$schema": "https://json-schema.org/draft/2020-12/schema",
  "$id": "https://spec2flow.dev/schemas/requirement-summary.schema.json",
  "title": "Spec2Flow Requirement Summary",
  "description": "Structured output for the requirements-analysis stage.",
  "type": "object",
  "required": ["taskId", "stage", "goal", "summary", "sources"],
  "additionalProperties": false,
  "properties": {
    "generatedAt": {
      "type": "string",
      "format": "date-time"
    },
    "taskId": {
      "type": "string",
      "minLength": 1
    },
    "stage": {
      "type": "string",
      "const": "requirements-analysis"
    },
    "goal": {
      "type": "string",
      "minLength": 1
    },
    "routeName": {
      "type": "string",
      "minLength": 1
    },
    "summary": {
      "type": "string",
      "minLength": 1
    },
    "sources": {
      "type": "array",
      "minItems": 1,
      "items": {
        "type": "string",
        "minLength": 1
      }
    },
    "scope": {
      "type": "object",
      "additionalProperties": false,
      "properties": {
        "inScope": {
          "type": "array",
          "items": {
            "type": "string",
            "minLength": 1
          }
        },
        "outOfScope": {
          "type": "array",
          "items": {
            "type": "string",
            "minLength": 1
          }
        }
      }
    },
    "impactedServices": {
      "type": "array",
      "items": {
        "type": "object",
        "required": ["name"],
        "additionalProperties": false,
        "properties": {
          "name": {
            "type": "string",
            "minLength": 1
          },
          "role": {
            "type": "string",
            "minLength": 1
          },
          "impact": {
            "type": "array",
            "items": {
              "type": "string",
              "minLength": 1
            }
          }
        }
      }
    },
    "acceptanceCriteria": {
      "type": "array",
      "items": {
        "type": "string",
        "minLength": 1
      }
    },
    "constraints": {
      "type": "array",
      "items": {
        "type": "string",
        "minLength": 1
      }
    },
    "repositoryGaps": {
      "type": "array",
      "items": {
        "$ref": "#/$defs/repositoryGap"
      }
    }
  },
  "$defs": {
    "repositoryGap": {
      "type": "object",
      "required": ["code", "message", "recoverable"],
      "additionalProperties": false,
      "properties": {
        "code": {
          "type": "string",
          "minLength": 1
        },
        "message": {
          "type": "string",
          "minLength": 1
        },
        "recoverable": {
          "type": "boolean"
        }
      }
    }
  }
}